Authors;Author full names;Author(s) ID;Title;Year;Source title;Volume;Issue;Art. No.;Page start;Page end;Page count;Cited by;DOI;Link;Abstract;Author Keywords;Index Keywords;Document Type;Publication Stage;Open Access;Source;EID
"Xu H.; Sun H.; Wang L.; Yu X.; Li T.";"Xu, Hong (57203983522); Sun, Haozun (57903673000); Wang, Lubin (57224113359); Yu, Xincan (58484665900); Li, Tianyue (57224901867)";"57203983522; 57903673000; 57224113359; 58484665900; 57224901867";Urban Architectural Style Recognition and Dataset Construction Method under Deep Learning of street View Images: A Case Study of Wuhan;2023;ISPRS International Journal of Geo-Information;12;7;264;;;;14;10.3390/ijgi12070264;https://www.scopus.com/inward/record.uri?eid=2-s2.0-85166183971&doi=10.3390%2fijgi12070264&partnerID=40&md5=c4ceff37d4d4810d7a73dce56d3b8048;The visual quality and spatial distribution of architectural styles represent a city’s image, influence inhabitants’ living conditions, and may have positive or negative social consequences which are critical to urban sensing and designing. Conventional methods of identifying architectural styles rely on human labor and are frequently time-consuming, inefficient, and subjective in judgment. These issues significantly affect the large-scale management of urban architectural styles. Fortunately, deep learning models have robust feature expression abilities for images and have achieved highly competitive results in object detection in recent years. They provide a new approach to supporting traditional architectural style recognition. Therefore, this paper summarizes 22 architectural styles in a study area which could be used to define and describe urban architectural styles in most Chinese urban areas. Then, this paper introduced a Faster-RCNN general framework of architectural style classification with a VGG-16 backbone network, which is the first machine learning approach to identifying architectural styles in Chinese cities. Finally, this paper introduces an approach to constructing an urban architectural style dataset by mapping the identified architectural style through continuous street view imagery and vector map data from a top-down building contour map. The experimental results show that the architectural style dataset created had a precision of 57.8%, a recall rate of 80.91%, and an F1 score of 0.634. This dataset can, to a certain extent, reflect the geographical distribution characteristics of a wide variety of urban architectural styles. The proposed approach could support urban design to improve a city’s image. © 2023 by the authors.;"architectural style recognition; construction method; dataset; deep learning; street view images";;Article;Final;"All Open Access; Gold Open Access";Scopus;2-s2.0-85166183971
"Iturburu L.; Liu X.; Zhang X.; Wogen B.E.; Villamizar J.N.; Dyke S.J.; Ramirez J.; Choi J.B.; Valencia G.; Alcocer S.M.";"Iturburu, Lissette (57194636996); Liu, Xiaoyu (57203202952); Zhang, Xin (57356117900); Wogen, Benjamin E. (58246769400); Villamizar, Juan Nicolas (59047525000); Dyke, Shirley J. (7003706556); Ramirez, Julio (35448832700); Choi, Jongseong Brad (58757096200); Valencia, Gianella (59043632600); Alcocer, Sergio M. (6602361698)";"57194636996; 57203202952; 57356117900; 58246769400; 59047525000; 7003706556; 35448832700; 58757096200; 59043632600; 6602361698";Building pose detection for the characterization of reinforced concrete buildings;2024;Structural Design of Tall and Special Buildings;33;13;e2120;;;;0;10.1002/tal.2120;https://www.scopus.com/inward/record.uri?eid=2-s2.0-85192257650&doi=10.1002%2ftal.2120&partnerID=40&md5=6151d83e58834c420f13634b404e4d9e;The automated identification of building characteristics for seismic vulnerability remains a challenge for governments due to the high number of buildings in cities. The diverse architectural styles of these buildings complicate the automated identification of building information (e.g., number of stories, structural system, and material type). Deep learning techniques lose accuracy as they generalize information, while the visual contents of a building exhibit a considerable range and diversity. This study leverages the pose detection technique to tackle such issues by focusing on a common construction style: reinforced concrete buildings representing columns, beams, or floors on the façade. With an aim to enable the assessment of seismic vulnerability, the technique developed herein is conceived for buildings with up to six stories that are more likely to be moment-frame buildings. The AI-enabled proposed framework starts with collecting building images and categorizing those containing this specific building type. A bounding box detector is then used to isolate building facades, for the subsequent identification of the structural frame with the High-Resolution Network (HR-Net). For demonstration, we illustrate this technique by identifying the structural frame on concrete buildings with a sample dataset developed based on buildings found in Mexico City in a pre-earthquake event state. © 2024 John Wiley & Sons Ltd.;"building inventories; computer vision; earthquakes; HR-net; pose detection; reinforced concrete buildings";"Computer vision; Concrete buildings; Deep learning; Gesture recognition; Reinforced concrete; Structural frames; Architectural style; Automated identification; Building characteristics; Building inventory; HR-net; Material's type; Pose detection; Reinforced concrete buildings; Seismic vulnerability; Structural systems; Earthquakes";Conference paper;Final;;Scopus;2-s2.0-85192257650
"Rababaah A.R.; Rababah A.M.";"Rababaah, Aaron Rasheed (22958029000); Rababah, Alaa Musa (59042912500)";"22958029000; 59042912500";Intelligent machine vision model for building architectural style classification based on deep learning;2023;International Journal of Computer Applications in Technology;70;1;;11;21;10;4;10.1504/IJCAT.2022.129893;https://www.scopus.com/inward/record.uri?eid=2-s2.0-85153874123&doi=10.1504%2fIJCAT.2022.129893&partnerID=40&md5=40c14a15cc3cf5d3d295ece71ee732d4;This paper presents an intelligent model for building architectural style classification. Image classification of architectural style is challenging to traditional machine vision methods. The main challenge in these systems is the feature extraction phase as there are many visual features in these styles that need to be extracted, refined and optimised. All these operations are done at the researcher discretion in traditional Machine Learning (ML) models. The advancements of ML to Deep Learning (DL) made automation of all the challenging operations possible. We constructed a machine vision model based on DL to investigate the effectiveness of DL in the classification problem at hand. A publicly available annotated data set was utilised to train and validate the proposed model. The data set consists of more than 5000 images of eight different architectural styles. The experimental results showed that the proposed model is reliable as it produced a classification accuracy of 95.44%. Copyright © 2022 Inderscience Enterprises Ltd.;"architectural styles classification; deep learning; feature extraction; impact of number kernels/features; machine intelligence; machine vision";"Architecture; Classification (of information); Computer vision; Deep learning; Extraction; Learning systems; Architectural style; Architectural style classification; Data set; Deep learning; Features extraction; Impact of number kernel/feature; Intelligent machine; Machine intelligence; Machine vision model; Machine-vision; Feature extraction";Article;Final;;Scopus;2-s2.0-85153874123
"Li H.; Dong H.";"Li, Huiyu (57842250800); Dong, Hailong (57842250900)";"57842250800; 57842250900";Architectural Style Classification Based on Deep Learning;2025;Computer-Aided Design and Applications;22;;;16;31;15;0;10.14733/cadaps.2025.S1.16-31;https://www.scopus.com/inward/record.uri?eid=2-s2.0-85197354170&doi=10.14733%2fcadaps.2025.S1.16-31&partnerID=40&md5=13692402d474dec45c267d74131fd16a;This article analyzes the efficient classification of computer models using different architectural styles. A precise feature application for computer-aided design was constructed by evaluating and classifying CAD data training. A deep learning-based model was used for building model training. The research experiment uses the evaluation model's test dataset classification information during the iterative process. Under strict training indicators, the test dataset showed a high-performance level in classifying architectural styles. In the automatic extraction process of architectural images, the method proposed in this article has a high ability for style transformation in processing architectural style data models. In the process of precise automatic extraction of architectural style, the model has a deeper efficiency in building data. This has high accuracy and application value in the style conversion of image architecture. © 2025 U-turn Press LLC.;"Classification Of Architectural Styles; Computer-Aided Design; Convolutional Neural Network; Data Fusion; Deep Learning";"Classification (of information); Computer aided design; Computer aided instruction; Convolutional neural networks; Data fusion; Data handling; Extraction; Iterative methods; Metadata; Statistical tests; Architectural style; Automatic extraction; Building model; CAD data; Classification of architectural style; Computer models; Computer-aided design; Convolutional neural network; Deep learning; Learning Based Models; Deep learning";Article;Final;"All Open Access; Gold Open Access";Scopus;2-s2.0-85197354170
"Sun M.; Zhang F.; Duarte F.; Ratti C.";"Sun, Maoran (57223105660); Zhang, Fan (57202400553); Duarte, Fabio (55150497000); Ratti, Carlo (35230766400)";"57223105660; 57202400553; 55150497000; 35230766400";Understanding architecture age and style through deep learning;2022;Cities;128;;103787;;;;80;10.1016/j.cities.2022.103787;https://www.scopus.com/inward/record.uri?eid=2-s2.0-85131439428&doi=10.1016%2fj.cities.2022.103787&partnerID=40&md5=f8ba7449f9837a01ef99b7ac5d150874;Architectural styles and their evolution are central to architecture history. However, traditional approaches to understand styles and their evolution require domain expertise, fieldwork and extensive manual processes. Recent research in deep learning and computer vision has highlighted the great potential in analyzing urban environments from images. In this paper, we propose a deep learning-based framework for understanding architectural styles and age epochs by deciphering building façades based on street-level imagery. The framework is composed of two stages: Deep ‘Learning’ the architecture and Deep ‘Interpreting’ the architecture age epochs and styles. In Deep ‘Learning’, a deep convolutional neural network (DCNN) model is designed to automatically learn about the age characteristics of building façades from street view images. In Deep ‘Interpreting’ stage, three components are proposed to understand the different perspectives regarding building ages and styles. In the experiment, a building age epoch dataset is compiled for the city of Amsterdam and Stockholm to understand the evolution of architectural element styles and the relationship between building ages and styles spatially and temporally. This research illustrates how publicly available data and deep learning could be used to trace the evolution of architectural styles in the spatial-temporal domain. © 2022;"Architectural style; Building age; Built environment; Deep learning; Street view imagery";"Amsterdam [North Holland]; Netherlands; North Holland; Stockholm [Stockholm (CNT)]; Stockholm [Sweden]; Sweden; architectural design; building; computer vision; imagery; machine learning; urban area";Article;Final;;Scopus;2-s2.0-85131439428
"Chen J.; Stouffs R.; Biljecki F.";"Chen, Jielin (57196109045); Stouffs, Rudi (6506322664); Biljecki, Filip (55609188900)";"57196109045; 6506322664; 55609188900";Hierarchical (multi-label) architectural image recognition and classification;2021;Projections - Proceedings of the 26th International Conference of the Association for Computer-Aided Architectural Design Research in Asia, CAADRIA 2021;1;;;161;170;9;7;;https://www.scopus.com/inward/record.uri?eid=2-s2.0-85104623071&partnerID=40&md5=d850b645e25cdd2956a3bcc2725b8559;The task of architectural image recognition for both architectural functionality and style remains an open challenge. In addition, the paucity of well-organized, large-scale architectural image datasets with specific consideration for the domain of architectural design research has hindered the exploration of these challenging tasks. Drawing upon images from the professional architectural website Archdaily®, and leveraging state-of-the-art deep-learning-based classification models, we explore a hierarchical multi-label classification model as a potential baseline for the task of architectural image classification. The resulting model showcases the potential for innovative architectural discipline-related analyses and demonstrates some heuristic insights for visual feature extraction pertaining to both architectural functionality and architectural style. © 2021 and published by the Association for Computer-Aided Architectural Design Research in Asia (CAADRIA), Hong Kong.;"Architectural functionality; Hierarchical classification; Image recognition; Multi-label classification; Style";"Classification (of information); Deep learning; Image classification; Image recognition; Large dataset; Architectural images; Architectural style; Classification models; Hierarchical multi-label classifications; Multi-label; State of the art; Visual feature extraction; Architectural design";Conference paper;Final;;Scopus;2-s2.0-85104623071
"Tejeswari B.; Sharma S.K.; Kumar M.; Gupta K.";"Tejeswari, B. (57742579400); Sharma, S.K. (57198534942); Kumar, M. (55367343600); Gupta, K. (57203610788)";"57742579400; 57198534942; 55367343600; 57203610788";BUILDING FOOTPRINT EXTRACTION FROM SPACE-BORNE IMAGERY USING DEEP NEURAL NETWORKS;2022;International Archives of the Photogrammetry, Remote Sensing and Spatial Information Sciences - ISPRS Archives;43;B2-2022;;641;647;6;6;10.5194/isprs-archives-XLIII-B2-2022-641-2022;https://www.scopus.com/inward/record.uri?eid=2-s2.0-85132034919&doi=10.5194%2fisprs-archives-XLIII-B2-2022-641-2022&partnerID=40&md5=52ea027c21d932cef47c7d1a25e4c527;One of the important and high-level detailing contained within basemaps is the ĝ€building feature'. Though pre-trained Deep Learning (DL) models are available for Building Feature Extraction (BFE), they are not efficient in predicting the buildings in other locations. This study explores the need and the major issue of implementing DL models for BFE from Very High Resolution Remote Sensing (VHRS) satellite data for any given area. Though advanced DL models are invented, in order to implement them, huge amount of potential training data is demanded for feed in. the building typologies are highly subjected to the context of study area including soil characteristics, culture/lifestyle/economy, architectural style and the building byelaws. The study believes that availability of enough training data of contextual buildings as one of the concern for effective model training. The study aims to extract the buildings present in the study area from Pleiades 1A (2019) RGB VHRS data using simple Mask R-CNN instance segmentation model which is training on the native contextual buildings. Here, an automated method of generating the location-specific training data for a given area is followed using Google Maps API (2021). The generated training data when trained on a deep learning architecture and predicted by the input data yielded promising results. The prediction accuracy of about 98.41% specificity, 96.20% predictive accuracy and 0.89 F1 score are achieved. The methods adopted assist the planning/governing bodies to accelerate the qualitative urban map preparation.  © 2022. International Archives of the Photogrammetry, Remote Sensing and Spatial Information Sciences - ISPRS Archives. All rights reserved. ;"Building foot-pint extraction; Deep Learning; Mask RCNN; Open Source training data; Open Street Map; Remote Sensing; Satellite imagery";"Buildings; Deep neural networks; Extraction; Satellite imagery; Space optics; Building foot-pint extraction; Deep learning; Learning models; Mask RCNN; Open source training data; Open street map; Open-source; Remote-sensing; Street maps; Training data; Remote sensing";Conference paper;Final;"All Open Access; Gold Open Access";Scopus;2-s2.0-85132034919
"Obeso A.M.; Benois-Pineau J.; Acosta A.Á.R.; Vázquez M.S.G.";"Obeso, Abraham Montoya (57016511800); Benois-Pineau, Jenny (6701750610); Acosta, Alejandro Álvaro Ramirez (6602671796); Vázquez, Mireya Saraí García (24366173900)";"57016511800; 6701750610; 6602671796; 24366173900";Architectural style classification of Mexican historical buildings using deep convolutional neural networks and sparse features;2017;Journal of Electronic Imaging;26;1;011016;;;;39;10.1117/1.JEI.26.1.011016;https://www.scopus.com/inward/record.uri?eid=2-s2.0-85007240156&doi=10.1117%2f1.JEI.26.1.011016&partnerID=40&md5=0f37f2e4d6b2c567a82e54fc11dd102b;We propose a convolutional neural network to classify images of buildings using sparse features at the network's input in conjunction with primary color pixel values. As a result, a trained neuronal model is obtained to classify Mexican buildings in three classes according to the architectural styles: prehispanic, colonial, and modern with an accuracy of 88.01%. The problem of poor information in a training dataset is faced due to the unequal availability of cultural material. We propose a data augmentation and oversampling method to solve this problem. The results are encouraging and allow for prefiltering of the content in the search tasks. © 2016 SPIE and IS&T.;"classification; convolutional neural network; cultural heritage; deep learning; image processing; indexing";"Architecture; Classification (of information); Convolution; Image processing; Indexing (materials working); Indexing (of information); Architectural style; Convolutional neural network; Cultural heritages; Data augmentation; Deep learning; Historical buildings; Poor information; Training dataset; Neural networks";Article;Final;;Scopus;2-s2.0-85007240156
"Ruga T.; Caroprese L.; Vocaturo E.; Zumpano E.";"Ruga, Tommaso (58883970800); Caroprese, Luciano (22833448800); Vocaturo, Eugenio (57188803544); Zumpano, Ester (6601916208)";"58883970800; 22833448800; 57188803544; 6601916208";Feasibility Analysis of an AI-Based Classification System for Cultural Heritage Building;2024;2024 IEEE International Workshop on Metrology for Living Environment, MetroLivEnv 2024 - Proceedings;;;;87;91;4;0;10.1109/MetroLivEnv60384.2024.10615638;https://www.scopus.com/inward/record.uri?eid=2-s2.0-85201201577&doi=10.1109%2fMetroLivEnv60384.2024.10615638&partnerID=40&md5=5f1ed9d542752a42a9f8d22f1a756d25;The country's historical and artistic heritage represents its identity and history. Art cities are often influenced by different architectural styles, sometimes easily distinguishable, thanks to characteristic elements, other times less so, due to influences caused by transition periods from one style to another, or by interventions over the centuries. Artificial Intelligence in recent years, has proven to be a valuable tool in the field of image classification, given its capacity to yield robust solutions across diverse domains. However, its application in the cultural heritage building image classification context remains relatively unexplored. This paper presents a preliminary feasibility study aimed at investigating the potential of deep learning techniques for the classification of cultural heritage building images. The goal could be to build a solution that can recognize, given an image of a historic building, the architectural style, which could improve the experience of a tourist who wants to know more about the visited place's history. The paper examines the results obtained with different neural network architectures, exploiting the Transfer Learning technique, but also draws attention to the challenges of the domain. Overall, encouraging results (AUC 0.98 and F1-score equal to 94-95%), demonstrate the effectiveness of the techniques tested and show how AI can help the classification and preservation of cultural heritage building. © 2024 IEEE.;"Cultural Heritage Buildings; Images Classification; Transfer Learning";"Architecture; Deep learning; Historic preservation; Image enhancement; Learning algorithms; Learning systems; Network architecture; Neural networks; Transfer learning; Architectural style; Characteristic elements; Classification system; Cultural heritage building; Cultural heritages; Feasibility analysis; Heritage buildings; Images classification; Learning techniques; Transfer learning; Image classification";Conference paper;Final;;Scopus;2-s2.0-85201201577
"Zhang Y.; Wang B.; Li J.";"Zhang, Yan (55235850200); Wang, Boyuan (57799326200); Li, Jimei (58796698200)";"55235850200; 57799326200; 58796698200";Kangba Region of Sichuan based on swin transformer visual model research on the identification of facades of ethnic buildings;2024;Scientific Reports;14;1;28742;;;;0;10.1038/s41598-024-78774-9;https://www.scopus.com/inward/record.uri?eid=2-s2.0-85209733995&doi=10.1038%2fs41598-024-78774-9&partnerID=40&md5=c50338192ca343eaf056784c18518c1b;The protection and restoration of existing buildings requires accurate acquisition of the characteristics of the building facade. The complex, diverse, and irregular distribution characteristics of the building facade components of ethnic minorities have led to a huge workload of field research, surveying, mapping, and calculation, and it is more difficult to extract its facade characteristics accurately. This study proposes a visual model based on the Swin Transformer and applies it to the graphic recognition of ethnic building elevations. The model combines the advantages of the migration learning method and deep neural network technology and is further enriched by layer normalization to improve the stability and extraction ability of model training. In the field survey of ethnic minority buildings in Kangba, Sichuan, 1100 images of local buildings were collected, including 8 different types of ethnic minority buildings. The experimental results show that compared with other mainstream deep neural network models, the Swin Transformer visual model shows excellent predictive performance to prove the effectiveness of the proposed method. This study also uses the t-sne dimension reduction method to verify the feature extraction ability of the Swin Transformer, which contributes to the protection and restoration of ethnic minority buildings, active exploration of energy conservation, digital archiving, and more. Provide theoretical and practical reference in the fields of architectural style and cultural research. © The Author(s) 2024.;"Deep learning; Ethnic minority buildings; Image recognition; Swin transformer; Transfer learning";"article; artificial neural network; controlled study; deep learning; deep neural network; dimensionality reduction; energy conservation; ethnic group; feature extraction; human; learning; nonhuman; transfer of learning; workload";Article;Final;"All Open Access; Gold Open Access";Scopus;2-s2.0-85209733995
