Authors;Author full names;Author(s) ID;Title;Year;Source title;Volume;Issue;Art. No.;Page start;Page end;Page count;Cited by;DOI;Link;Abstract;Author Keywords;Index Keywords;Document Type;Publication Stage;Open Access;Source;EID
"Vlăsceanu G.V.; Drăguț A.; Sandu G.; Tarbă N.; Voncilă M.-L.; Boiangiu C.-A.; Goga N.";"Vlăsceanu, Giorgiana Violeta (57192818593); Drăguț, Alin (58563020200); Sandu, Gabriel (57415672400); Tarbă, Nicolae (57223104037); Voncilă, Mihai-Lucian (57110434400); Boiangiu, Costin-Anton (6506993286); Goga, Nicolae (8727472200)";"57192818593; 58563020200; 57415672400; 57223104037; 57110434400; 6506993286; 8727472200";ARCHITECT: EXTRACTING BUILDING RELATED INFORMATIONS AND CHANGING ARCHITECTURAL STYLE IN AR;2023;UPB Scientific Bulletin, Series C: Electrical Engineering and Computer Science;85;3;;65;76;11;0;;https://www.scopus.com/inward/record.uri?eid=2-s2.0-85169842177&partnerID=40&md5=b1c35e061c99d938cf0ea3adc756746d;With recent advancements in mobile computing, augmented reality (AR) applications can now achieve real-time performance. AR provides a novel way to engage with our surroundings. Platforms such as ARKit or ARCore make AR app development easy. ARchitect aims to allow users to experience different architectural styles and cultural heritages by altering the appearance of buildings in their environment. The presented solution utilizes deep learning and computer vision techniques to classify architectural styles, which is a challenging task due to the inter-class relationships between styles. The approach presented in the paper alters the style of a building detected from the phone’s camera and retrieves information such as its current style, age, and distance from the user. To train the deep learning models, a publicly available dataset of photos of buildings with 25 different styles is used. The obtained results for architectural style classification surpass state-of-the-art methods, demonstrating the effectiveness of deep learning techniques. Additionally, the presented approach for architectural style transformation is also promising and will improve as new research is conducted in image generation, monocular depth estimation, and surface reconstruction methods. © 2023, Politechnica University of Bucharest. All rights reserved.;"AR; architectural style change; architectural style classification; image generation; monocular depth estimation; object saliency detection; surface reconstruction";"Architecture; Deep learning; Image classification; Image enhancement; Image reconstruction; Learning systems; Object detection; Object recognition; Surface reconstruction; Architectural style; Architectural style change; Architectural style classification; Depth Estimation; Image generations; Monocular depth estimation; Object saliency detection; Saliency detection; Surfaces reconstruction; Augmented reality";Article;Final;;Scopus;2-s2.0-85169842177
"Han Q.; Yin C.";"Han, Qing (57948781500); Yin, Chao (57221927168)";"57948781500; 57221927168";Architectural Style Classification of the Chinese Traditional Settlements using Deep Learning;2023;Proceedings of SPIE - The International Society for Optical Engineering;12552;;125522X;;;;0;10.1117/12.2667749;https://www.scopus.com/inward/record.uri?eid=2-s2.0-85159308642&doi=10.1117%2f12.2667749&partnerID=40&md5=702541fd6692b2f7737318b1cb2e2d0d;This paper investigates state-of-the-art deep learning techniques to achieve automatic architectural style classification of the Chinese traditional settlements. First, a new annotated dataset is built with six typical Chinese architectural styles, consisting of over 1000 web-crawled images and an original image collection of Chinese traditional settlements. Second, a state-of-the-art convolutional network named DenseNet is benchmarked on the new dataset to learn the effectiveness of the deep learning networks. Yet, the DenseNet network suffered server overfitting on the small-sized new dataset. Third, to overcome the common overfitting problem, a new deep learning framework named DenseNet-TL-Aug is developed by leveraging transfer learning (TL) and data augmentation (DA) techniques, e.g., AutoAugment. The experimental results demonstrate that the new developed framework achieves much better classification performance in classifying the Chinese traditional style images than the original DenseNet, significantly mitigating the overfitting problem. This study will contribute to automated landscape gene recognition as well as the design and development of traditional tourism. © 2023 SPIE.;"Architectural Style Classification; Chinese Traditional Settlements; Convolutional Neural Networks; Deep learning";"Architecture; Convolution; Deep learning; Learning systems; Transfer learning; Web crawler; Annotated datasets; Architectural style; Architectural style classification; Chinese traditional settlement; Convolutional neural network; Deep learning; Learning techniques; Over fitting problem; State of the art; Transfer learning; Convolutional neural networks";Conference paper;Final;;Scopus;2-s2.0-85159308642
"Obeso A.M.; Vázquez M.S.G.; Acosta A.A.R.; Benois-Pineau J.";"Obeso, Abraham Montoya (57016511800); Vázquez, Mireya S. García (24366173900); Acosta, Alejandro A. Ramirez (6602671796); Benois-Pineau, Jenny (6701750610)";"57016511800; 24366173900; 6602671796; 6701750610";Connoisseur: Classification of styles of Mexican architectural heritage with deep learning and visual attention prediction;2017;ACM International Conference Proceeding Series;;;a16;;;;28;10.1145/3095713.3095730;https://www.scopus.com/inward/record.uri?eid=2-s2.0-85030784474&doi=10.1145%2f3095713.3095730&partnerID=40&md5=ebea7bdd8927d082c8e87622c3a8b17b;The automatic description of multimedia content was mainly developed for classification tasks, retrieval systems and massive ordering of data. Preservation of cultural heritage is a field of high importance for application to this method. Our problem is classification of architectural styles of buildings in digital photographs of Mexican cultural heritage. The selection of relevant content in the scene for training classification models allows them to be more precise in the classification task. Here we use a saliency-driven approach to predict visual attention in images and use it to train a Convolutional Neural Network to identify the architectural style of Mexican buildings. Also, we present an analysis of the behavior of the models trained under the traditional cropped image and the prominence maps. In this sense, we show that the performance of the saliency-based CNNs is better than the traditional training reaching a classification rate of 97% in validation dataset. It is considered that style identification with this technique can make a wide contribution in video description tasks, specifically in the automatic documentation of Mexican cultural heritage. © 2017 Association for Computing Machinery.;"CNN; Cultural heritage; Deep learning; Image classification; Visual attention prediction";"Deep learning; Architectural heritage; Architectural style; Classification tasks; Cultural heritages; Deep learning; Images classification; Multimedia contents; Retrieval systems; Visual Attention; Visual attention prediction; Convolutional neural networks";Conference paper;Final;;Scopus;2-s2.0-85030784474
"Lotte R.G.; Haala N.; Karpina M.; de Aragão L.E.O.C.; Shimabukuro Y.E.";"Lotte, Rodolfo Georjute (56548930600); Haala, Norbert (6601958644); Karpina, Mateusz (57190379189); de Aragão, Luiz Eduardo Oliveira e Cruz (9279986800); Shimabukuro, Yosio Edemir (7006392180)";"56548930600; 6601958644; 57190379189; 9279986800; 7006392180";3D façade labeling over complex scenarios: A case study using convolutional neural network and structure-from-motion;2018;Remote Sensing;10;9;1435;;;;20;10.3390/rs10091435;https://www.scopus.com/inward/record.uri?eid=2-s2.0-85053636024&doi=10.3390%2frs10091435&partnerID=40&md5=386b2bcff33fe6b7855d5a39eb743374;"Urban environments are regions in which spectral variability and spatial variability are extremely high, with a huge range of shapes and sizes, and they also demand high resolution images for applications involving their study. Due to the fact that these environments can grow even more over time, applications related to their monitoring tend to turn to autonomous intelligent systems, which together with remote sensing data could help or even predict daily life situations. The task of mapping cities by autonomous operators was usually carried out by aerial optical images due to its scale and resolution; however new scientific questions have arisen, and this has led research into a new era of highly-detailed data extraction. For many years, using artificial neural models to solve complex problems such as automatic image classification was commonplace, owing much of their popularity to their ability to adapt to complex situations without needing human intervention. In spite of that, their popularity declined in the mid-2000s, mostly due to the complex and time-consuming nature of their methods and workflows. However, newer neural network architectures have brought back the interest in their application for autonomous classifiers, especially for image classification purposes. Convolutional Neural Networks (CNN) have been a trend for pixel-wise image segmentation, showing flexibility when detecting and classifying any kind of object, even in situations where humans failed to perceive differences, such as in city scenarios. In this paper, we aim to explore and experiment with state-of-the-art technologies to semantically label 3D urban models over complex scenarios. To achieve these goals, we split the problem into two main processing lines: first, how to correctly label the façade features in the 2D domain, where a supervised CNN is used to segment ground-based façade images into six feature classes, roof, window, wall, door, balcony and shop; second, a Structure-from-Motion (SfM) and Multi-View-Stereo (MVS) workflow is used to extract the geometry of the façade, wherein the segmented images in the previous stage are then used to label the generated mesh by a ""reverse"" ray-tracing technique. This paper demonstrates that the proposed methodology is robust in complex scenarios. The façade feature inferences have reached up to 93% accuracy over most of the datasets used. Although it still presents some deficiencies in unknown architectural styles and needs some improvements to be made regarding 3D-labeling, we present a consistent and simple methodology to handle the problem. © 2018 by the authors.";"3D reconstruction; Deep-learning; Façade feature detection; Structure-from-motion";"Antennas; Complex networks; Convolution; Deep learning; Image classification; Image segmentation; Intelligent systems; Network architecture; Neural networks; Problem solving; Ray tracing; Remote sensing; Roofs; 3D reconstruction; Automatic image classification; Autonomous intelligent systems; Convolutional neural network; Convolutional Neural Networks (CNN); Feature detection; State-of-the-art technology; Structure from motion; Stereo image processing";Article;Final;"All Open Access; Gold Open Access; Green Open Access";Scopus;2-s2.0-85053636024
"Xu H.; Wang L.; Fang Z.; He M.; Hou X.; Zuo L.; Guan F.; Xiong C.; Gong Y.; Pang Q.; Zhang H.; Sun S.; Nadire A.";"Xu, Hong (57203983522); Wang, Lubin (57224113359); Fang, Zhixiang (9632604800); He, Minghui (57224105947); Hou, Xuecheng (57224113165); Zuo, Liang (57217311880); Guan, Fangli (57218328129); Xiong, Ce (57224110241); Gong, Yiyu (57224101617); Pang, Qinglin (57224104987); Zhang, Han (56012534200); Sun, Shuteng (57224115248); Nadire, Aimaier (57224111220)";"57203983522; 57224113359; 9632604800; 57224105947; 57224113165; 57217311880; 57218328129; 57224110241; 57224101617; 57224104987; 56012534200; 57224115248; 57224111220";"Street-Facing Architectural Image Mapping and Architectural Style Map Generation Method Using Street View Images; [街景影像下的临街建筑风格映射及地图生成方法]";2021;Wuhan Daxue Xuebao (Xinxi Kexue Ban)/Geomatics and Information Science of Wuhan University;46;5;;659;671;12;3;10.13203/j.whugis20200445;https://www.scopus.com/inward/record.uri?eid=2-s2.0-85106970571&doi=10.13203%2fj.whugis20200445&partnerID=40&md5=6440c1dc8dcb8369e27c267d02a0aced;"Objectives: Each region has specific characteristics of architectural styles, and a detailed investigation of the geographical distribution of architectural styles is conducive to the protection of historic buildings, the development of special tourism resources and the scientific planning of urban architectural areas. However, the number of urban buildings is large, manual collection and investigation cannot meet the needs of large-scale operations. In recent years, Google and other Internet companies have launched street view images. Street view images are high resolution, containing a full range of urban street views as well as precise location and posture information, which provide a possibility to explore the geographic distribution of urban architectural styles. Therefore, we use deep learning to identify and match the styles of street view building areas, and establish a mapping relationship between the building area images and building outlines, so as to construct the generation method of a large-scale urban architectural style map in detail. Methods: The style identification and map matching of architectural areas in street view images are the key and difficulty in generating urban architectural style maps. Firstly, we extract the building area images of various styles through Faster R-CNN. In order to establish the mapping relationship between building area images and single building outlines, we construct a building location mapping method by matching the same name building area in two adjacent street view images, then the building can be located by forward intersection. Secondly, for the single building image without a same-name area, we also propose a building azimuth mapping method, which combines the spatial azimuth relationship between the street view building area and building outlines in a digital map. The intersection of union (IoU) of the single building image azimuth range and the building outline azimuth range can help match the building area in a street view image and building outlines in a digital map. Finally, Technique for order preference by similarity to an ideal solution is used to determine the unique style attribute of each map building outline to solve the multiple mapping problem of a single building and generate a fine-grained architectural style map. Results: The experimental results of the proposed method are as follows: (1) The average accuracy of Faster R-CNN detection of 19 types of architectural style areas on the test set is 73.81%. (2) The accuracy of matching two adjacent street images with the same name architectural area is 86.1%, the recall is 90.3%, and the average time to match an architectural region pair is 180.1 ms, which is 25.4% less than the time using SURF(speeded up robust features) under spherical epipolar geometry constraint and an accuracy improvement of 19.4%; (3) The accuracy of a building location mapping method is 85.1%, the mapping success rate is only 49.33%, and the average time for two corresponding building area to complete location mapping is 2.741 s; the accuracy of the building azimuth mapping method is 80.3%, the mapping success rate is 88.0%, and the average time for a single building area to complete azimuth mapping is 0.017 s. (4) In the test region, the building azimuth mapping method is more likely to cause multiple mapping problems, with 42.9% of the building outlines matching to multiple building images compared to 23.4% for the building location mapping method. (5) By verifying the style attributes of 331 building outlines in a digital map, we obtain a mean classification accuracy of 55.1%, a mean recall of 76.4%, and a mean F1 score of 0.601 for the architectural style maps. Conclusions: Under the two architectural area mapping methods, the generation time of architectural style maps is short, and the F1 score of classification is 0.601, which can basically reflect the geographic distribution characteristics of a large range of urban architectural styles. In addition, the regional and similarity of architectural styles is the main reason for the difficulty in classifying architectural style images, which affects the classification accuracy of architectural style maps and can be studied in more depth in the future. © 2021, Editorial Board of Geomatics and Information Science of Wuhan University. All right reserved.";"Architectural style classification; Building visual localization; Deep learning; Street view image matching; Street view images";"Convolutional neural networks; Deep learning; Geographical distribution; Image enhancement; Location; Tourism; Accuracy Improvement; Architectural images; Classification accuracy; Distribution characteristics; Forward intersections; Mapping relationships; Speeded up robust features; Style identifications; classification; digital map; geographical distribution; historic building; machine learning; mapping; urban area; Architecture";Article;Final;;Scopus;2-s2.0-85106970571
"Dautov E.; Astafeva N.";"Dautov, Eldar (57223093387); Astafeva, Natalia (57205458347)";"57223093387; 57205458347";Convolutional Neural Network in the Classification of Architectural Styles of Buildings;2021;Proceedings of the 2021 IEEE Conference of Russian Young Researchers in Electrical and Electronic Engineering, ElConRus 2021;;;9396452;274;277;3;9;10.1109/ElConRus51938.2021.9396452;https://www.scopus.com/inward/record.uri?eid=2-s2.0-85104706529&doi=10.1109%2fElConRus51938.2021.9396452&partnerID=40&md5=082c1e90ca4a248ab2135c17df5f4cce;The article focuses on the implementation of the project for the classification of architectural styles of buildings. We use modern deep learning methods using convolutional neural networks for realization of this project. Image classification using CNN has many implementations. However, the recognition of architectural styles is not fully researched. This article presents a neural network capable of determining from a photograph of a building its belonging to a certain style of architecture. We train a deep CNN classifier model to classify buildings belonging to 15 different architectural styles. We use a data set that we have collected from open sources of the global Internet to do this. © 2021 IEEE.;"Architectural styles; CNN; Deep learning; Image classification";"Architecture; Convolution; Deep learning; Learning systems; Architectural style; Classifier models; Data set; Global Internet; Learning methods; Open sources; Convolutional neural networks";Conference paper;Final;;Scopus;2-s2.0-85104706529
"Obeso A.M.; Benois-Pineau J.; Vázquez M.S.G.; Acosta A.A.R.";"Obeso, A. Montoya (57016511800); Benois-Pineau, J. (6701750610); Vázquez, M. S. García (24366173900); Acosta, A. A. Ramírez (6602671796)";"57016511800; 6701750610; 24366173900; 6602671796";Saliency-based selection of visual content for deep convolutional neural networks: Application to architectural style classification;2019;Multimedia Tools and Applications;78;8;;9553;9576;23;13;10.1007/s11042-018-6515-2;https://www.scopus.com/inward/record.uri?eid=2-s2.0-85053042423&doi=10.1007%2fs11042-018-6515-2&partnerID=40&md5=5328845d43de22566067e32cc0a874ec;The automatic description of digital multimedia content was mainly developed for classification tasks, retrieval systems and massive ordering of data. Preservation of cultural heritage is a field of high importance of application of these methods. We address classification problem in cultural heritage such as classification of architectural styles in digital photographs of Mexican cultural heritage. In general, the selection of relevant content in the scene for training classification models makes the models more efficient in terms of accuracy and training time. Here we use a saliency-driven approach to predict visual attention in images and use it to train a Deep Convolutional Neural Network. Also, we present an analysis of the behavior of the models trained under the state-of-the-art image cropping and the saliency maps. To train invariant models to rotations, data augmentation of training set is required, which posses problems of filling normalization of crops, we study were different padding techniques and we find an optimal solution. The results are compared with the state-of-the-art in terms of accuracy and training time. Furthermore, we are studying saliency cropping in training and generalization for another classical task such as weak labeling of massive collections of images containing objects of interest. Here the experiments are conducted on a large subset of ImageNet database. This work is an extension of preliminary research in terms of image padding methods and generalization on large scale generic database. © 2018, Springer Science+Business Media, LLC, part of Springer Nature.;"Cultural heritage; Data selection; Deep learning; Visual attention prediction";"Architecture; Behavioral research; Convolution; Deep learning; Historic preservation; Image processing; Neural networks; Search engines; Architectural style; Classification models; Classification tasks; Cultural heritages; Data Selection; Deep convolutional neural networks; Digital photographs; Visual Attention; Deep neural networks";Article;Final;;Scopus;2-s2.0-85053042423
"Loufakis M.; Symeonidis P.; Fontalis S.; Ioannidis D.; Tzovaras D.";"Loufakis, M. (58499216000); Symeonidis, P. (57213617645); Fontalis, S. (58655793800); Ioannidis, D. (19638392200); Tzovaras, D. (13105681700)";"58499216000; 57213617645; 58655793800; 19638392200; 13105681700";Employing Deep Learning Framework to Support Location Management for the Audio-Visual Industry;2023;2023 8th International Conference on Image, Vision and Computing, ICIVC 2023;;;;942;947;5;0;10.1109/ICIVC58118.2023.10270287;https://www.scopus.com/inward/record.uri?eid=2-s2.0-85175611328&doi=10.1109%2fICIVC58118.2023.10270287&partnerID=40&md5=8e58e5a2cd659bb50c3c6cda0fcf3bcd;This paper presents a specialized tool for film producers and managers to extract useful information from images of different locations. The resulting framework can be used for image retrieval and other applications related to film production and location scouting. The framework uses deep learning models to extract labels, colors, seasons, emotions, and building architecture from input images. The methodology is described in detail, outlining the different steps involved in image processing and feature extraction. The label extraction module uses a transfer learning approach with pre-trained CNN models fine-tuned on a custom dataset of 106 classes. The color extraction module uses the LAB color space, a device-independent and perceptually uniform color space, in image processing applications, to accurately identify the dominant color, while the season extraction module extracts seasonal information from input images. The emotion extraction module identifies the emotion portrayed in an image, and the architectural style module automatically identifies the style of buildings in photos. Finally, the embedding module combines various vectors representing different image aspects to create a general embedding for each image. © 2023 IEEE.;"artificial intelligence; building architecture identification; CNN models; color extraction; deep learning; embedding; emotion extraction; feature extraction; film production; image processing; image retrieval; LAB color space; label extraction; location scouting; season extraction; transfer learning";"Color; Deep learning; Embeddings; Extraction; Feature extraction; Image processing; Image retrieval; Location; Building architecture identification; CNN models; Color extraction; Colour spaces; Deep learning; Embeddings; Emotion extractions; Features extraction; Film production; Images processing; LAB color space; Label extraction; Location scouting; Season extraction; Transfer learning; Architecture";Conference paper;Final;;Scopus;2-s2.0-85175611328
